"","titular"
"229","Regiones de O’Higgins y Del Maule superan los cinco mil casos acumulados de Covid-19, y porcentaje de ventiladores disponibles vuelve a los dos dígitos"
"230","Galería: Así se ve Italia en su primer día de cuarentena nacional debido al coronavirus"
"231","Las fechas que se barajan para los Juegos de Tokio"
"232","Chilenos en cuarentena: La experiencia en Tortel y de otras personas aisladas en sus casas tras el auge del Covid-19"
"233","

                
                
                Calendario de vacunación: personas entre 34 y 30 años recibirán primera dosis la próxima semana
"
"234","Coronavirus: Banco Central Europeo anuncia medidas para contener efectos económicos sin recortar tasas de interés"
"235","Mnuchin y enemigo de Musk apoyan intento de reapertura de Tesla"
"236","

                
                
                Gobierno se abre a mesa técnica que resuelva voto de pacientes COVID y otros casos en elecciones del 2021
"
"237","Vicepresidente de EE.UU. es el primer miembro de la Casa Blanca en vacunarse contra el Covid-19"
"238","

                
                
                Bolsonaro da positivo por coronavirus por tercera vez
"
"239","Hay todo un historial de problemas con Zoom que convocan a ser cuidadosos"
"240","Jeffrey Sachs: “Necesitamos elevar nuestro comportamiento ético y el compromiso con el bien común”"
"241","Estudio advierte: Efectos del coronavirus amenazan con sumir en la pobreza a más de 500 millones de personas"
"242","Perú evalúa endurecer restricciones para frenar rebrote de coronavirus"
"243","La pandemia deja más de 600.000 casos en el mundo durante el último día y roza el umbral de los 129 millones de contagios"
"244","Explosión de nuevos casos llevó positividad de los tests a un peak de 18%"
"245","¿El estilo Paris?: Ministro plantea idea de que balance del coronavirus sea más técnico y cada tres días"
"246","La Fórmula 1 cancela las pruebas de Azerbaiyán, Singapur y Japón"
"247","Sin público, sin saludos y algunos con mascarilla... Conoce las estrictas medidas con las que vuelve la Bundesliga"
"248","Fallece cónsul de Chile en Rosario diagnosticado con coronavirus"
"249","

                
                
                Presionado por las condiciones de RN y la UDI, Gobierno enfrenta hoy la votación de la prórroga del estado de excepción en la Cámara
"
"250","En qué se diferencian el Capítulo 11 con la Ley de Reemprendimiento chilena"
"251","Minsal reporta 27 decesos y 1.550 nuevos contagios: Testeos PCR totales superan los 5 millones y positividad fue de 3,92%"
"252","Cumbre del G7 parte en Inglaterra con el cambio climático y las vacunas como prioridades"
"253","Singapur y el Covid-19: del éxito al ocaso en 20 días"
"254","Minsal da a conocer datos de trazabilidad: Cinco regiones llegan a 100% y Valparaíso es la que tiene el menor índice"
"255","Ministro Walker afirma que embajador chino en Chile le expresó que coronavirus ""bajará su intensidad"" en los próximos 10 días"
"256","Autoridades cancelan definitivamente la edición 2020 del festival de Coachella"
"257","

                
                
                Defensoría de la Niñez informa que mantendrá modalidad de trabajo remoto a sus funcionarios
"
"258","Facebook pone fin a la prohibición de publicaciones que afirman que el Covid-19 fue creado por el hombre"
"259","Ministro de salud británico asegura que Boris Johnson está en “muy buen estado de salud”"
"260","Rebrotes de contagios por coronavirus en Beijing parecen disminuir según cifras de autoridades chinas"
"261","Neyün, Keepex, Ambumátic: estos son los cinco ventiladores mecánicos más prometedores que se diseñan en Chile"
"262","Argentina inicia vacunación con Sputnik V: Trabajdores de la salud y gobernador de Buenos Aires fueron inoculados"
"263","

                
                
                Los laboratorios universitarios, claves en el testeo de COVID-19 en Chile
"
"264","Anuncian el regreso de la Fórmula E con intenso calendario de seis carreras en nueve días"
"265","Luis Musrri: “Mi ida a la U fue un retroceso en lo profesional”"
"266","Ad portas de juntas de accionistas: Las alertas de los presidentes de grandes empresas por el estallido social y coronavirus"
"267","Las imágenes que dejan las primeras horas del desconfinamiento parcial en Valdivia"
"268","OMS dice que “quizá nunca haya” una “bala de plata” contra el virus"
"269","Estado de Florida registra más de 10 mil nuevos casos de coronavirus en un día, superando así los 300 mil contagiados"
"270","Piñera califica de ""mala noticia” el último Imacec y llama a los partidos políticos a colaborar para fortalecer la “red de protección”"
"271","La Moneda informa que el Presidente Piñera dio negativo a examen para detectar coronavirus"
"272","La calle en pandemia: La mitad de los conductores seguirá usando el auto, mientras crecen peatones y ciclistas"
"273","Pase de movilidad, fechas y edades: Preguntas y respuestas que dejó el anuncio de la dosis de refuerzo"
"274","El mea culpa de Mañalich: el exministro de Salud analizó sus fallas en la crisis sanitaria"
"275","Minsal reportó 6.263 contagios por Covid-19: positividad fue de un 7,77 por ciento a nivel nacional"
"276","Ministro Paris por investigación de muertes por Covid: “No hay ningún problema en entregar los datos”"
"277","Santiago Alba Rico:  “Preferimos un enemigo con un plan  que un azar desatado sobre el mundo”"
"278","

                
                
                Políticos de oposición llaman al Gobierno a ""modificar sus conductas"" y ofrecer ""soluciones concretas"" en medio de la pandemia
"
"279","MTT presenta plan de movilidad para retorno gradual con 222 medidas: Incluye ciclovías temporales y semáforos más cortos"
"280","Alemania registra más de 17 mil nuevos casos mientras continúa subiendo la tasa de incidencia"
"281","""No hay cerveza"" en México: Paralización ante coronavirus golpea al mayor exportador de la bebida en el mundo"
"282","Ministro Paris asegura que “probablemente” a mediados de junio comenzará la vacunación de los menores de 18 años"
"283","Salud e instructivo del Ministerio Público para fiscalizaciones: ""Como autoridad sanitaria seguiremos aplicando la normativa"""
"284","Dolly Parton aportó un millón de dólares para financiar la vacuna de un laboratorio contra el coronavirus"
"285","INDH llama al Poder Judicial a revisar medidas cautelares y pide al Gobierno evitar crisis sanitaria en cárceles"
"286","¿Cuál es la posibilidad de contagiarse en las “terrazas transitorias”?"
"287","Golpeada por una segunda ola y con cifras récord: La evolución de la pandemia en India"
"288","Mineduc inicia entrega de canastas de alimentación tras suspensión de clases: beneficiará a un millón 600 mil estudiantes"
"289","Por ahora solo hay pequeñas señales de las medidas de DC y Marvel Comics por el coronavirus"
"290","Permiso de vacaciones ha sido solicitado por 223 mil personas: Valparaíso, Coquimbo y La Araucanía las regiones más visitadas"
"291","Bachelet afirma que la pandemia ""dejó al descubierto todas las fisuras y fragilidades de nuestras sociedades"""
"292","Grupo de expertos propone una tasa global a las empresas mínimo de 25% en medio de crisis por covid-19"
"293","En EE.UU. recomiendan cubrirse la cara en lugares públicos: Trump asegura que medida es voluntaria y no lo hará"
"294","Mujer argentina pasa su cuarentena en un hotel cinco estrellas en París y le pagan por ello"
"295","Selección de pacientes y casi 3 mil muertos: el desborde de Perú"
"296","“Ningún otro caso como este”: niño de 3 años tuvo un derrame cerebral después de sufrir Covid"
"297","Pandemia hunde fusiones mundiales a nivel más bajo desde 2012"
"298","COVID-19: diez medidas que debe seguir si vive en edificio"
"299","En lo que va de abril hemos superado tres veces los 10 mil casos diarios de coronavirus entre confirmados y probables"
"300","Detenidos por infracciones sanitarias se disparan un 52% durante última jornada"
"301","Minsal reporta 120 decesos y 7.304 nuevos casos: Positividad llegó a 10,29%"
"302","Llega un millón de dosis de Sinovac: Chile ya ha recibido más de 23,7 millones de dosis"
"303","¿Por qué la OMS se niega a declarar pandemia por coronavirus?"
"304","Retail Financiero estima que tendrían problemas de liquidez por US$1.000 millones mensuales en caso de aprobarse proyecto que posterga créditos de forma masiva"
"305","Nueve regiones del país muestran una velocidad de transmisión del virus superior a lo recomendado"
"306","OMS advierte que el mundo está al borde de un ""catastrófico fracaso moral"" si los países ricos acaparan las vacunas"
"307","Se suspende partido entre Valdivia y Ñublense por casos de Covid-19"
"308","“Política desigual” y “ahorros embargables”: La minuta de la Segpres a los diputados y autoridades para el debate sobre el retiro de fondos de pensiones"
"309","

                
                
                Informe epidemiológico: Chile superó la barrera de 30 mil decesos por covid-19 entre confirmados y probables
"
"310","Guillier le mete mano y edita video del gobierno que buscaba generar conciencia sobre el Covid-19"
"311","Comisión Retorno define su primer objetivo: mantener el formato del torneo"
"312","El regreso de Dios"
"313","

                
                
                La ONU teme más violencia de género y pobreza para las mujeres por el COVID-19
"
"314","Facebook cancela su conferencia anual de desarrolladores por el coronavirus"
"315","Unión Europea cree necesario investigar el origen de la pandemia de covid-19"
"316","Fang Fang, la escritora que desafía a China con su diario del virus"
"317","La lámina que compartió Contralorito para responder a quienes dudan de la vacuna contra el Covid"
"318","Paris explica los ""determinantes sociales"" considerados para el desconfinamiento parcial de Los Ríos y Aysén"
"319","El impacto de los rebrotes en España"
"320","Balance diario del Minsal: nuevos casos Covid-19 rozan los ocho mil y se reportan 133 fallecidos"
"321","Confirman el primer fallecimiento en Japón a causa del coronavirus"
"322","Chile registra segunda cifra más alta de casos diarios en la pandemia"
"323","Menor incidencia de activos en 14 regiones: El contraste en los indicadores epidemiológicos previo al ""18"" entre 2020 y este año"
"324","Fiestas de fin de año y Covid-19 ¿Podemos celebrar con amigos o familiares sin mascarilla?"
"325","México estima que alcanzará ""inmunidad de rebaño"" ante el covid-19 en agosto y amplía puntos de vacunación"
"326","

                
                
                Triste récord: Brasil supera el millón de casos de COVID-19 y se aproxima a las 50.000 muertes
"
"327","Mercado corrige con fuerza sus proyecciones y prevé caída del PIB del segundo trimestre de -4,9%"
"328","España permitirá desde el lunes el ingreso a las personas que acrediten estar vacunados"
"329","María Fernanda Ampuero, escritora: La desigualdad en las vacunas “da para escribir un cuento de terror”"
"330","Fiscalía abrió investigación de oficio por eventual delito sanitario de pastor evangélico de La Pintana"
"331","Estados Unidos supera las 100.000 muertes por COVID-19"
"332","Cuerpo de Bomberos Metropolitano Sur confirma dos voluntarios contagiados de Covid-19"
"333","Evo Morales recibió el alta medica tras doce días hospitalizado por Covid-19"
"334","Mociones inadmisibles, iniciativas por covid-19 y críticas al Ejecutivo: ¿Cómo evalúas el trabajo de los senadores en medio de la pandemia?"
"335","

                
                
                Covid-19: el gráfico que muestra el riesgo de contagio de coronavirus según la actividad que hagas
"
"336","Informe de expertos recomendó el lunes “evaluar la expansión de la cuarentena” en Región Metropolitana"
"337","Joaquín Niemann da positivo y se pierde el Masters"
"338","Plan de emergencia: oposición cuestiona marco fiscal propuesto"
"339","El diagnóstico de la presidenta del Colegio Médico sobre el manejo de cifras de Covid-19 por parte del Minsal: “Necesitamos mayor transparencia”"
"340","Informe epidemiológico: casos activos a nivel alcanzan cuarto récord consecutivo y casi 90% de las comunas en Chile superan los 100 contagiantes por cada 100 mil habitantes"
"341","

                
                
                Guía práctica de los test de covid-19: para qué sirven y para qué no
"
"342","India suma más de 24.000 casos nuevos de coronavirus y 333 muertos en las últimas 24 horas"
"343","Brasil supera los 80.000 muertos y los 2,1 millones de casos de coronavirus"
"344","Hasta los mineros lloran la partida de “Pipo Arancibia”"
"345","Chile supera los 3,3 millones de personas vacunadas contra el coronavirus, el 21,7% de la población objetivo"
"346","El reclamo de las autoridades de Tarapacá tras el alza de casos de covid-19 en la región"
"347","Google lanzó iniciativa contra la desinformación sobre el coronavirus"
"348","El coronavirus llegó a Chile"
"349","Cirugía ginecológica mínimamente invasiva en pandemia: Más segura que nunca"
"350","DEIS: Fallecimientos atribuidos al Covid-19 ascienden a 33.759 a nivel nacional y abril se posiciona como el tercer mes con más decesos de toda la pandemia"
"351","Cámara despacha a Comisión Mixta proyecto que crea Fondo de Emergencia Covid-19"
"352","Decesos por coronavirus en Chile llegarían a 13.939 sumando confirmados y sospechosos"
"353","Minsal reporta 50 decesos y 1.923 nuevos contagios: Segundo día consecutivo con récord de exámenes y positividad es 4,88%"
"354","Taquicardia extrema, dolor en el pecho, náuseas insoportables: sobreviviente de coronavirus revela los terroríficos síntomas que experimentó"
"355","Vacuna contra el Covid-19 de la Universidad de Oxford anuncia una eficacia del 70%"
"356","Zico ha vuelto y es chileno"
"357","Infectóloga italiana Giuseppina Liuzzi en Chile: ""Hemos vivido y vivimos las mismas batallas"""
"358","A una semana de iniciada la vacunación masiva, 1.128.359 personas han sido inoculadas en el país contra el Covid-19"
"359","Gobierno anuncia proyecto para suplementar ingresos de trabajadores a honorarios"
"360","¿Cuándo aterrizó el virus en Chile?: una pregunta que debemos dilucidar"
"361","Gobierno previo a interpelación a Paris: Oposición ""tuvo mala suerte, porque hoy justo es cuando hay menos casos"""
"362","Minsal reporta 39 decesos y cifra de casos nuevos desciende a 1.711: Positividad es la más alta desde octubre"
"363","Experto en salud pública advierte por aglomeraciones de Navidad en plena pandemia: “No hay que responsabilizar solo a las personas/falta fiscalización de la autoridad”"
"364","Efecto pandemia: medición detectó fuerte alza de obesidad y sobrepeso en niños"
"365","Cómo el virus ha cambiado al transporte público en el mundo"
"366","Hacienda alista medidas por crisis y Banco Central sale a reforzar liquidez en pesos y dólares"
"367","Caso helicópteros: Imputados deberán hacer donación benéfica y no podrán realizar vuelos por tres meses"
"368","Estados Unidos superó los cinco millones de contagios por Covid-19"
"369","""Un dolor de cuerpo brutal"": Los crudos testimonios de dos deportistas contagiados con el coronavirus"
"370","

                
                
                Balance del Covid-19 en Chile: fallecidos superan la barrera de los cinco mil
"
"371","Minsal planea instalar hospitales modulares en caso de potencial demanda de camas por contagios de Covid-19"
"372","En lo que va de julio se han reportado más casos que en los primeros 11 meses de pandemia: La evolución del covid en Cuba"
"373","Ocho de las 16 regiones de Chile superan los 100 nuevos casos diarios de Covid-19 en la jornada con mayor cantidad de contagios desde julio"
"374","Wall Street sufrió dura caída en medio del pesimismo del mercado ante los resultados de Amazon y otras compañías"
"375","Alcaldes de Los Ríos y Aysén ante ""desconfinamiento gradual"": Piden fiscalización rigurosa y garantías ""que den tranquilidad"""
"376","Toque de queda comenzará a la medianoche en todo el país, con excepción de Magallanes y Puerto Montt"
"377","""Niebla mental"": La secuela que afecta a los pacientes con covid-19 que también se ha detectado en Chile"
"378","Rusia supera los 145.000 contagiados por coronavirus tras sumar de nuevo más de 10.000 positivos en un día"
"379","Italia registra la menor cifra de fallecidos diarios desde el inicio de la pandemia"
"380","Ministro Figueroa cuestiona al Colegio de Profesores por ""vanagloriarse o casi alegrarse cada vez que un colegio cierra"""
"381","“Se busca... ¡De preferencia muerto!”: El detalle de la denuncia por amenazas en Twitter contra Mañalich"
"382","Diputada Núñez empuja el “Plan Antofagasta” para levantar a la región del impacto de la pandemia"
"383","¿Un salario mínimo de $500 mil?: Economistas analizan escenario para la negociación del nuevo reajuste"
"384","Los números que preocupan a la zona norponiente del Gran Santiago: cuatro comunas superan los 100 casos activos por cada 100 mil habitantes"
"385","Nadal tuvo que dejar niños en cuarentena dentro de su academia"
"386","Minsal y evaluación de Fase 2 en la RM: “La reducción de movilidad esperamos que impacte favorablemente en las cifras de contagio”"
"387","Memoria visual de un traslado aéreo"
"388","

                
                
                Los casos mundiales de Covid-19 superan los 50 millones después de un peak de 30 días
"
"389","

                
                
                Lo sorprendieron intentando robar: hombre con COVID-19 escapó en dos oportunidades de residencia sanitaria en Concepción
"
"390","Se acabó el carrete: cierran todas las discos de la Región Metropolitana"
"391","Pandemia sigue al alza en EE.UU.:  Acumula 530.624 muertes y 29.212.779 contagios por covid-19"
"392","Infractores al toque de queda caen un 11% y permisos temporales un 18% durante última jornada"
"393","Tres fiestas, más de cien personas: el eventual brote que preocupa a las comunas de Zapallar y Puchuncaví"
"394","Carabineros ha cursado más de seis mil detenciones sanitarias en medio de pandemia y surgen primeros indultados reincidentes"
"395","

                
                
                Autoridades con Covid-19 en Venezuela: Diosdado Cabello y el gobernador de Zulia están contagiados
"
"396","Argentina sumó 275 fallecidos y 6.614 casos de Covid-19 en las últimas 24 horas"
"397","Entrenando en los pasillos: masiva protesta por cierre de gimnasios en pleno Costanera Center"
"398","La increíble historia de una orden de Néstor Kirchner que podría acercar las vacunas de Cuba a Argentina"
"399","La historia del arquero argentino que fichó por Temuco y que está en cuarentena tras compartir avión con un contagiado de coronavirus"
"400","Casos en La Moneda y en La Araucanía: Los resguardos de las autoridades para prevenir contagios"
"401","VIDEOS. Así fue el masivo carrete en Barrio Bellavista, que muchos tildaron como la “Cepa Bellavista”"
"402","Aumenta demanda  en grandes estudios de abogados tras Covid-19"
"403","Mueren 22 pacientes de covid en India al cortarse el suministro de oxígeno"
"404","Columna de Paula Escobar: Extraño autogol"
"405","“Maskne” y los problemas en la piel que ha dejado la pandemia"
"406","Alumnos chinos retornan a clases con pulseras electrónicas para detectar el coronavirus"
"407","Médico del Stade de Reims se suicida al saber de su contagio"
"408","México reporta 596 nuevos fallecidos por Covid-19"
"409","Minsal reporta 61 decesos y 1.517 nuevos contagios: Positividad llegó al 4,2%, la más baja desde que hay registro"
"410","

                
                
                Estudio ""Vida en Pandemia"" revela el impacto económico de la crisis en las personas: 73% de encuestados dijo tener problemas para pagar créditos
"
"411","Superintendencia de Salud ordena a isapres a aprobar todas las licencias médicas por covid-19 que han sido rechazadas"
"412","Erick Pulgar supera el coronavirus y aguarda por retomar el trabajo"
"413","Gestor sanitario y test para internos y funcionarios: anuncian nuevas medidas para disminuir contagios de COVID-19 en cárcel de Puente Alto"
"414","Los futbolistas que iban camino a su mejor temporada en Europa antes de que se desatara el coronavirus"
"415","Covid-19: Chile es elegido para participar de los ensayos de la vacuna del laboratorio Johnson & Johnson"
"416","Israel pone fin a la mascarilla obligatoria en lugares públicos cerrados"
"417","Ventas del comercio electrónico casi se triplican en un año en medio de crisis por coronavirus"
"418","Minsal pone en marcha operativo en comunas con menor tasa de inoculación: 64% de las personas de 47 años han acudido a los vacunatorios"
"419","Consejo Asesor recomienda iniciar vacunación con Sinovac a niños de 3 a 12 años"
"420","Casos en la RM aumentan en un 45% en la última semana y Minsal condena fiestas clandestinas"
"421","Clase Abierta: Mindfulness y cómo practicarlo"
"422","Consejo de Estabilidad Financiera oficia al Congreso por riesgo sistémico de proyectos en discusión"
"423","Presidente del Grupo PSA reconoce que ""no podemos resistir mucho tiempo en ausencia casi total de ingresos"""
"424","Argentina registra nuevo récord diario de contagios y muertes por coronavirus: 35.543 casos y 745 decesos"
"425","Valparaíso y Frutillar: Escuelas de Rock estrena programa de radio desde las dos ciudades musicales de Chile"
"426","Bitácora de viajeros: vivir 14 días bajo sospecha"
"427","Minsal anuncia nueva restricción para el ingreso a Chile tras detectar cepa británica en el país: cuarentena de diez días será obligatoria"
"428","Comunidad médica expresa alerta por “fragilidad de la situación sanitaria” en el país y pide “privilegiar lo sanitario en el plan Paso a Paso”"
"429","Mujer murió al caer en un acantilado mientras se sacaba una foto para celebrar el fin de la cuarentena en Turquía"
"430","Minsal investiga aplicación de protocolos en Sanatorio Alemán de Concepción ante aumento de casos de covid-19 en el recinto"
"431","Alemania dice que iniciará su campaña de vacunación el 27 de diciembre"
"432","EE.UU. contabiliza más de 1.200 muertes en 24 horas por covid-19 y alcanza los 330 mil contagios en total"
"433","Fallecido por coronavirus en Concepción padecía un daño hepático crónico"
"434","Argentina: Gobernador de Buenos Aires anuncia regreso presencial a clases en el conurbano  de la ciudad"
"435","Piñera conversó con mandatario argentino tras impasse entre ambos gobiernos"
"436","El duelo en tiempos de pandemia"
"437","

                
                
                Espacio Público alerta que casos de covid-19 en la RM ""casi se han duplicado en las últimas seis semanas""
"
"438","Covid-19: Colmed admite preocupación de que funcionarios capacitados lleguen al límite"
"439","Australia registra récord de casos de covid-19 en segunda oleada de contagios"
"440","Daza y denuncia contra Paris por cumpleaños en el Minsal: ""Hemos recibido una carta sin mayores antecedentes"""
"441","Carabineros no contará con Simccar en fiscalización de cuarentena: Gobierno asegura que ""solo ralentizará"" controles"
"442","Agencia de la ONU pide que se anule deuda de las economías en desarrollo: cifra se calcula en US$ 1 billón"
"443","La economía chilena da una positiva sorpresa y logra crecer en el primer trimestre del año"
"444","

                
                
                Balance del COVID-19: hay 1.988 nuevos contagios y 62 fallecidos
"
"445","Tres de cada cuatro trabajadores de servicios transitorios no tenían empleo anterior o trabajaban informalmente"
"446","Casos diarios de Covid-19 en Chile vuelven a superar los dos mil y casos activos otra vez superan los 13 mil"
"447","La Casa Blanca confirma casos de Covid-19 entre sus  funcionarios ya vacunados"
"448","Expertos anticipan ""fuertes perturbaciones"" en la economía de China, la gran infectada por la epidemia del coronavirus"
"449","El enigma de Magallanes: ¿una peligrosa mutación, culpa de Argentina o desobediencia civil?"
"450","Imacec de -3,5% en marzo: Briones asegura que ""está en línea con lo que esperábamos"" y adelanta que ""abril debería ser peor"""
"451","El mundo refuerza medidas por temor a rebrotes del coronavirus"
"452","Matías Godoy, el pepero chileno que gambetea al coronavirus en Taiwán"
"453","Cuarentena en comunas de La Araucanía será desde mañana e intendente dice que ""era necesario tomar medidas más estrictas"""
"454","Corte de Santiago declara inadmisible recurso de protección interpuesto contra convenio del Sename y la ANI"
"455","Asociaciones de colegios particulares se suman al debate: ""Hay que hacer el esfuerzo de retornar lo antes posible"""
"456","El 64,7% de los detenidos en la RM por delitos contra la salud pública fue arrestado esta última semana"
"457","Ventiladores desocupados en el país llegan al nivel más bajo"
"458","Daza defiende vacuna de refuerzo tras solicitud que hizo la OMS para que países suspendan tercera dosis"
"459","McDonald’s se acoge a Ley de Protección de Empleos y retoma poco a poco sus operaciones"
"460","Confirman séptima víctima fatal por coronavirus en Italia"
